Norton-360,Cybersecurity for small business-Yearly,3500
McAfee-Antivirus Program,Cybersecurity for small to medium business-Yearly,4000
Kaspersky-Antivirus Software,Enterprise threat protection and remediation for medium to large businesses-Yearly,15000
Bitdefender-Antivirus-Plus,Advanced Protection for small business-Yearly,4000
MalwareBytes,Advanced Malware and Ransomware threat protection-Yearly,9000
AVG-Technologies,Cybersecurity for your device-Yearly,7000
Avast-Antivirus,Basic Security measures for your device-Yearly,6000
ES-ET,Advanced protection and remediation for medium to large businesses-Yearly,8000
Fortinet,Advanced Firewall and browsing protection-Yearly,5500
Kaspersky-Labs,Enchanced Firewall and Malware protection,8800